commentId,text,channel_type,likeCount,video_title,label_llm,label_revisao
Ugyy4bR-BE6Hj7zB7f14AaABAg,"Eu me sinto quase um alien. Sempre fui sozinha. Mas agora sinto falta de ter amizades verdadeiras.
Não consigo ser superficial e infelizmente só encontro coisas rasas.",amador,227,como fazer amigos depois do isolamento (e paranóias de ser chata),TANGENCIAL,
UgzuMF9R0S-5fI8YyQ14AaABAg,"Não espere mudança deles.
Saber o tipo de narcisista.
Estabelecer limites.
Conhecer as táticas.
Não entre em discussões
Retome poder sobre suas emoções
Não reaja 
Mantenha uma rede de apoio
Não faça retaliação, n se vingue
Aprenda a se amar , tenha autoestima.
Entenda os ciclos de abuso .
Tenha espectativas reais com eles.
Transferência de baixa autoestima.",profissional,52,O que fazer quando o narcisista convive com você? #98,TANGENCIAL,
Ugw91_yZbipwqUsSXvF4AaABAg,A série mais linda da vida!❤️,profissional,4,"Karnal Recomenda: ""This Is Us"" - 6ª temporada | Leandro Karnal",POSITIVO,
Ugx-JhwJZSSJjleo3g14AaABAg,"O dinheiro comprou toda possibilidade de punição, em todos os níveis da justiça, e não raro há políticos envolvidos. Nenhuma surpresa.",profissional,0,Caso Epstein: Como o Sistema Falhou por 14 Anos? | ANA BEATRIZ,TANGENCIAL,
Ugzr_jjho965IKg_fMp4AaABAg,Cadê você por aqui... volta!,amador,0,EXPRESSÃO MÁXIMA DO DESCONFORTO | PARTE 2,NEGATIVO,
Ugz0ip8U-fe_OoOY2P94AaABAg,Ninguém mais que perfeito para fazer esse resumo 👏👏👏🫶 amei,profissional,0,"Karnal Recomenda: ""This Is Us"" - 6ª temporada | Leandro Karnal",POSITIVO,
